{
  "created_at": "2026-08-09T10:00:00Z",
  "decided_at": "2026-08-09T10:10:00Z",
  "expires_at": "2026-08-16T10:00:00Z",
  "id": "proposal_superseded",
  "operation": "create",
  "proposal_version": 1,
  "relations": [],
  "requested": {
    "key": "architecture.database",
    "kind": "decision",
    "scope": {
      "id": "project_abc",
      "kind": "project"
    }
  },
  "result": null,
  "schema_version": "1",
  "status": "superseded"
}
