{
  "created_at": "2026-08-09T10:00:00Z",
  "decided_at": "2026-08-09T10:10:00Z",
  "expires_at": "2026-08-16T10:00:00Z",
  "id": "proposal_create_approved",
  "operation": "create",
  "proposal_version": 1,
  "relations": [],
  "requested": {
    "key": "architecture.database",
    "kind": "decision",
    "scope": {
      "id": "project_abc",
      "kind": "project"
    }
  },
  "result": {
    "memory_id": "mem_created",
    "memory_version": 1,
    "receipt_id": "rcpt_created_v1"
  },
  "schema_version": "1",
  "status": "approved"
}
